,author,title
189,"Issi Issie, Issy Ivett, Ivette Ivie, Ivonne Ivory, Ivy Izabel, Izzi Jacenta",Then we get into a situation where the military is not paying the bill.
190,"Jacinda Jacinta, Jacintha Jacinthe, Jackelyn Jacki, Jackie Jacklin, Jacklyn Jackquelin, Jackqueline Jacky","Of course, the most important ingredient in a healthy life is the right amount of calcium. That's why you'll find that buttery, buttery, crumbly, and full-bodied ingredients are naturally found in kiwi, tocopherols, and other plant-based foods."
191,"Jaclin Jaclyn, Jacquelin Jacqueline, Jacquelyn Jacquelynn, Jacquenetta Jacquenette, Jacquetta Jacquette, Jacqui Jacquie","Since 1973, the U.S. has run a U.N. Sustainable Development Goals and a U.N. Sustainable Development Goals-Coalition (SODC) Interim Framework. The U.N. Sustainable Development Goals, the U.N. Sustainable Development Bank Compact and the U.N. Sustainable Development Goals-Coalition member States are a set of international agreements that engage the U.N. in all stages of development. The U.N. promotes and enforces the principle of universal inclusion in the development management and production sectors. In the years since the U.N. was established, U.N. Member States have applied for, ratified and ratified the U.N. Sustainable Development Goals-Coalition in order to promote the development of a more equitable and sustainable world. In the early 1990s, the U.N. Sustainable Development Goals and U.N. Sustainable Development Goals-Coalition concluded a three-year period of intensive and ongoing negotiations to participate in the Global Food Crisis and the development of a sustainable and just world. In the early 1990s, the U.N. Sustainable Development Goals-Coalition led a comprehensive United Nations-led multilateral review and enhanced U.N. support for the U.N. Agenda 21 and the U.N. Agenda 2030. In March 2011, the U.N. Sustainable Development Goals-Coalition met to reaffirm the U.N. Security Council resolutions on the need to promote equality of opportunity, development, science and technology in all its forms, including those associated with the right to life, human rights and basic freedoms. In the same year, the U.N. Sustainable Development Goals-Coalition met in Geneva to reaffirm the U.N. Security Council resolutions on the need to promote equality of opportunity, development, science and technology in all its forms, including those associated with the right to life, human rights and basic freedoms. In 2012, the U.N. Sustainable Development Goals-Coalition met in New York to reaffirm the U.N. Security Council resolutions on the need to promote equality of opportunity, development, science and technology in all its forms, including those associated with the right to life, human rights and basic freedoms. In 2015, the U.N. Sustainable Development Goals-Coalition met in New York to reaffirm the U.N. Security Council resolutions on the need to promote equality of opportunity, development, science and technology in all its forms, including those associated with the right to life, human rights and basic freedoms. In 2016, the U.N. Sustainable Development Goals-Coalition met in New York to reaffirm the U.N. Security Council resolutions on the need to promote equality of opportunity, development, science and technology in all its forms, including those associated with the right to life, human rights and basic freedoms. In 2017, the U.N. Sustainable Development Goals-Coalition met in New York to reaffirm the U.N. Security Council resolutions on the need to promote equality of opportunity, development, science and technology in all its forms, including those associated with the right to life, human rights and basic freedoms. In 2018, the U.N. Sustainable Development Goals-Coalition met in New York to reaffirm the U.N. Security Council resolutions on the need to promote equality of opportunity, development, science and technology in all its forms, including those associated with the right to life, human rights and basic freedoms. In 2019, the U.N. Sustainable Development Goals-Coalition met in New York to reaffirm the U.N. Security Council resolutions on the need to promote equality of opportunity, development, science and technology in all its forms, including those associated with the right to life, human rights and basic freedoms. In 2020, the U.N. Sustainable Development Goals-Coalition met in New York to reaffirm the U.N. Security Council resolutions on the need to promote equality of opportunity, development, science and technology in all its forms, including those associated with the right to life, human rights and basic freedoms. In 2021, the U.N. Sustainable Development Goals-Coalition met in New York to reaffirm the U.N. Security Council resolutions on the need to promote equality of opportunity, development, science and technology in all its forms, including those associated with the right to life, human rights and basic freedoms. In 2022, the U.N. Sustainable Development Goals-Coalition met in New York to reaffirm the U.N. Security Council resolutions on the need to promote equality of opportunity, development, science and technology in all its forms, including those associated with the right to life, human rights and basic freedoms. In 2023, the U.N. Sustainable Development Goals-Coalition met in New York to reaffirm the U.N. Security Council resolutions on the need to promote equality of opportunity, development,"
192,"Jacynth Jada, Jade Jaime, Jaimie Jaine, Jaleh Jami, Jamie Jamima, Jammie Jan",The cephalobranchs of the cephalopod family are involved in the pathogenesis of rheumatoid arthritis and nephritis
193,"Jana Janaya, Janaye Jandy, Jane Janean, Janeczka Janeen, Janel Janela, Janella Janelle",Mitogen-activated protein kinase (MAPK) regulates renal cell migration and migration in vitro
194,"Janene Janenna, Janessa Janet, Janeta Janetta, Janette Janeva, Janey Jania, Janice Janie","The Red Sox are fielding a legitimate backup goaltender, but it will require a great deal of work with the rotation and the front office, as the Red Sox have struggled with right-handed pitchers. The Red Sox have not been able to get a quality starter on the mound in recent years, and the bullpen has been a major issue."
195,"Janifer Janina, Janine Janis, Janith Janka, Janna Jannel, Jannelle Janot, Jany Jaquelin","""It's a serious question, and it's not going to be answered in the way it should be answered in the way it should be answered, and I don't see it being answered in the way it should be answered,"" Trump said."
196,"Jaquelyn Jaquenetta, Jaquenette Jaquith, Jasmin Jasmina, Jasmine Jayme, Jaymee Jayne, Jaynell Jazmin","Dairy-based proteins are naturally occurring, and they are the basis of the proteins in dairy proteins."
197,"Jean Jeana, Jeane Jeanelle, Jeanette Jeanie, Jeanine Jeanna, Jeanne Jeannette, Jeannie Jeannine",8-Methoxazole-3-Odichlorohepans-3-Orioles-Inhibitors Are A New Type of Antigens
198,"Jehanna Jelene, Jemie Jemima, Jemimah Jemmie, Jemmy Jen, Jena Jenda, Jenelle Jenette",by Frank A. Zletich
199,"Jeni Jenica, Jeniece Jenifer, Jeniffer Jenilee, Jenine Jenn, Jenna Jennee, Jennette Jenni","The ""war on drugs"" has been a game changer for our country."
200,"Jennica Jennie, Jennifer Jennilee, Jennine Jenny, Jeraldine Jeralee, Jere Jeri, Jermaine Jerrie","The human brain is the core of the fundamental structure of the neocortex and the hippocampus, and the neurons in the cortex are involved in memory, emotion, and decision-making. In the cortex, the presynaptic LTD pathway is involved in the release of nastymic acid, which confers novel antidepressant and antipsychotic properties. In the hippocampus, a novel p38-dependent protein, tau9p1, plays a central role in the regulation of neuronal plasticity and neurogenesis. In the nucleus accumbens, the nuclei from which the c-Fos are thought to play their roles in chemical metabolism are selectively exposed to sodium and potassium ion. In a mouse model of diabetes mellitus, insulin resistance leads to reduced glucose and insulin-like growth factor-1 expression and decreased proliferation of the p38/ADR pathway. In this view, the expression of a novel pathway involved in the regulation of cellular and organismal immunity, autoimmunity and apoptosis in Type 2 diabetes is associated with a decreased susceptibility to both acute pancreatitis and nephropathy, in combination with a reduced incidence of nephropathy-associated nephropathy in patients with type 2 diabetes, a nephrotic syndrome, a cerebrovascular disease, and a neurodegenerative disease of the cerebellum. In a mouse model of renal cell carcinoma, a novel bile acid-deficient strain of Escherichia coli increases the susceptibility of cultured kidney cells to mycetoma and apoptosis by up to 19-fold. In diabetic patients with renal fibrosis, a novel serine protease-deficient strain of Escherichia coli can prevent mononuclear cell proliferation and apoptosis by down-regulating AUC1. In a mouse model of renal cell carcinoma, a transmembrane transmembrane glycosylation pathway regulates the p38/ADR pathway and the renal tubular matrix. In a murine model of renal cell carcinoma, the p38/ADR pathway plays a role in tumor-associated cell growth, cell death, and tumor necrosis-associated protein-1 expression. In a murine model of renal cell carcinoma, a K562/ADR-dependent pathway regulates the p38/ADR pathway and the renal tubular matrix. In a murine model of renal cell carcinoma, a K562/ADR-dependent pathway regulates the p38/ADR pathway and the renal tubular matrix. In this model, we demonstrate that K562/ADR expression contributes to the inhibition of the ADH-2 cell cycle by a novel chaperone-dependent protein. In this context, we show that a novel, non-invasive, and low-cost, noninvasive, and translational inhibitor of the K562/ADR-dependent pathway, imidacloprid, inhibits the tumor-associated cell growth and apoptosis induced by human chrysotile asbestos in vivo and in vitro, as well as by human chrysotile asbestos-DRG-2-infected human monoclonal antibody and in vivo by targeting the tau1/2-component pathway. Together, these results indicate that K562/ADR-dependent pathways are involved in the suppression of tumor-associated cell growth and tumor-associated apoptosis in vivo."
201,"Jerrilee Jerrilyn, Jerrine Jerry, Jerrylee Jess, Jessa Jessalin, Jessalyn Jessamine, Jessamyn Jesse","The A-300 is a solid steel barrel. Its diameter is 1.7 meters, and its thickness is 2.7 meters. In addition to this, the barrel is made of a thin layer of material called a ""plate"" which is exposed to direct heat and gas from the engine while in contact with the metal. The plate is a very dense and dense material, and is particularly important for the critical components of the anti-personnel and anti-tank rocket systems. It is a critical component of the anti-tank missile systems."
202,"Jesselyn Jessi, Jessica Jessie, Jessika Jessy, Jewel Jewell, Jewelle Jill, Jillana Jillane",Caspase-1 and Caspase-2 Antigens Induce Antirecellular Pathogenicity in Nuclei
203,"Jillayne Jilleen, Jillene Jilli, Jillian Jillie, Jilly Jinny, Jo Jo Ann, Jo-Ann Jo-Anne",The 19-year-old was a passenger on a private jet from Brussels to Paris in November 2013 when a gunman opened fire on two police officers while they were on an operation in Brussels airport.
204,"JoAnn JoAnne, Joan Joana, Joane Joanie, Joann Joanna, Joanne Joannes, Jobey Jobi",cmc_kills_bp(4) -cKlaxg2 -Dpk_Kills__ p+__c__k_P<__c__m__k__b__c_p___
205,"Jobie Jobina, Joby Jobye, Jobyna Jocelin, Joceline Jocelyn, Jocelyne Jodee, Jodi Jodie","As a result, the leading cause of cancer deaths among women is the dearth of calcium, a leading cause of osteoporosis in women."
206,"Jody Joela, Joelie Joell, Joella Joelle, Joellen Joelly, Joellyn Joelynn, Joete Joey","Follow us on Facebook and follow us on Twitter @OnTheJob.<|endoftext|>Continuing with the storyline of the main focus of the story here, we are back with a story about the world of The Crossing and the potential of the new character for the story of Crossing."
207,"Johanna Johannah, Johnette Johnna, Joice Jojo, Jolee Joleen, Jolene Joletta, Joli Jolie","The jet stream's core circulation is much younger than the Arctic's, and thus its circulation is less sensitive to changing ocean circulation. The warmer the ocean, the more the jet stream holds its core, which can make it more susceptible to the effects of ocean acidification."
208,"Joline Joly, Jolyn Jolynn, Jonell Joni, Jonie Jonis, Jordain Jordan, Jordana Jordanna","Then, in the middle of a war between humans and aliens, the Captain recruits some new soldiers to patrol the area and they are disappointed to find that they are not being treated as soldiers, but rather as enemies."
209,"Jorey Jori, Jorie Jorrie, Jorry Joscelin, Josee Josefa, Josefina Joselyn, Josepha Josephina",BASIC VIOLATION: Differentiation of Clostridium difficile-associated with Enterococcus faecium in Antigens Associated with Neurotoxicity
210,"Josephine Josey, Josi Josie, Joslyn Josselyn, Josy Jourdan, Joy Joya, Joyan Joyann","The U.S. economy is now stronger than it has been in almost a century, but the cost per U.S. dollar is falling and the U.S. dollar is being eroded by the weakening of the yen and the weaker dollar in the euro area."
211,"Joyce Joycelin, Joye Joyous, Juana Juanita, Jude Judi, Judie Judith, Juditha Judy",MEMBERSHIP:
212,"Judye Julee, Juli Julia, Juliana Juliane, Juliann Julianna, Julianne Julie, Julienne Juliet","Changes to its energy planning and control system to prevent and respond to the growth of new, disruptive energy sources."
213,"Julieta Julietta, Juliette Julina, Juline Julissa, Julita June, Junette Junia, Junie Junina","The 3.5-in. R9 270 is a bit too small for me, but I've always wanted a 3.5-in. version of the R9 270 CNC-M1/M1.7-compatible 3-in. bearing. Is there a way to add a custom diameter and/or diameter of the rattle from the original to the next?"
214,"Justin Justina, Justine Jyoti, Kacey Kacie, Kacy Kai, Kaia Kaila, Kaile Kailey","I have also been forced to look for a way of living and a way to live in a more peaceful world. I have been forced to work in a different way from where I was when I was young, and have grown up in a culture that condemns those who have tried to be a part of a better world. I have been forced to learn to love myself and live a better life."
215,"Kaitlin Kaitlyn, Kaitlynn Kaja, Kakalina Kala, Kaleena Kali, Kalie Kalila, Kalina Kalinda","The domain ""adblock.com.msn.cn.slug"" appears to be a fake."
216,"Kalindi Kalli, Kally Kameko, Kamila Kamilah, Kamillah Kandace, Kandy Kania, Kanya Kara","I have a 2 year old son, who does not like to play with his grandmothers toys. I can't find any information about how to prevent him from playing with the toy she got him from a junkie. I tried to prevent him from playing with the toy she got him from a junkie, but she slapped my elbow a few weeks ago and told me she was sorry."
217,"Kara-Lynn Karalee, Karalynn Kare, Karee Karel, Karen Karena, Kari Karia, Karie Karil",There are a lot of studies that show that the inflammation that is produced when a person eats too much is actually caused by a protein called forminin.
218,"Karilynn Karin, Karina Karine, Kariotta Karisa, Karissa Karita, Karla Karlee, Karleen Karlen","The Orioles are also without right-handed pitcher Javier Baez, who is with the Orioles. Baez is with the Yankees. Baez was with the Cubs from 2008-12."
219,"Karlene Karlie, Karlotta Karlotte, Karly Karlyn, Karmen Karna, Karol Karola, Karole Karolina","In August, the Drug Enforcement Administration began enforcing a five-year rule that would have banned most foreign drug markets. As a result, tens of thousands of people have been arrested for drug offenses in the United States since the recent surge in drug sales."
220,"Karoline Karoly, Karon Karrah, Karrie Karry, Kary Karyl, Karylin Karyn, Kasey Kass","The researchers said that the core circulation is already at its lowest point on record, but is at its highest point in the Arctic Ocean."
221,"Kassandra Kassey, Kassi Kassia, Kassie Kaster, Kat Kata, Katalin Kate, Katee Katerina","The genus Curyplasma cv, which is an uncommon but important constituent of C. elegans, is associated with the abundance of several phylum-level proteins"
222,"Katerine Katey, Kath Katha, Katharina Katharine, Katharyn Kathe, Katheleen Katherina, Katherine Katheryn",The caspase-1-dependent caspase-2 inhibits the self-incompatibility of the CCR5 gene and the TIMP-1-dependent caspase-2 in C57BL/6J mice
223,"Kathi Kathie, Kathleen Kathlene, Kathlin Kathrine, Kathryn Kathryne, Kathy Kathye, Kati Katie",I know that I am your land.
224,"Katina Katine, Katinka Katleen, Katlin Katrina, Katrine Katrinka, Katti Kattie, Katuscha Katusha","The Patriots, and Belichick's career in general, has been plagued by injuries. They have two of the NFL's best pass-catcher in Kevin Hogan, and the Patriots are tied for the NFL's worst rushing defense, despite having the league's second-fewest passing yards after the catch. Injuries have also hampered their defense in recent years."
225,"Katy Katya, Kay Kaycee, Kaye Kayla, Kayle Kaylee, Kayley Kaylil, Kaylyn Kee","The trade is a huge one for the Orioles, a team that was without a starting pitcher in the second half of last year's season. But the farm system has been a major issue in the Orioles system, as the club has struggled to find a consistent role player for the past two seasons, and Harrison is not a natural athlete who can be a reliable stopgap when needed."
226,"Keeley Keelia, Keely Kelcey, Kelci Kelcie, Kelcy Kelila, Kellen Kelley, Kelli Kellia","The Independent Journal Review, a government-backed initiative that promotes free trade in Hong Kong, is a leading force in the fight against corruption, human rights violations and human rights abuses."
227,"Kellie Kellina, Kellsie Kelly, Kellyann Kelsey, Kelsi Kelsy, Kendra Kendre, Kenna Keren","""The U.S. is not helping the PKK or the PKK allies in this fight, but they should have their own bases in Gaziantep and there could be a U.S. ground presence in the area,"" the official said."
228,"Keri Keriann, Kerianne Kerri, Kerrie Kerrill, Kerrin Kerry, Kerstin Kesley, Keslie Kessia","The U.S. official said the Turkish military, in line with its commitment to ""ground the ground against terrorism and ensure the safety of the security and stability of the region,"" is ""disengaging in the fight against terrorism."""
229,"Kessiah Ketti, Kettie Ketty, Kevina Kevyn, Ki Kia, Kiah Kial, Kiele Kiersten",The investigators are expected to release a report by the end of the month.
230,"Kikelia Kiley, Kim Kimberlee, Kimberley Kimberli, Kimberly Kimberlyn, Kimbra Kimmi, Kimmie Kimmy",The measure would provide for a $1 billion increase to the state's Medicaid program to cover about $500 million in new federal funding for Medicaid.
231,"Kinna Kip, Kipp Kippie, Kippy Kira, Kirbee Kirbie, Kirby Kiri, Kirsten Kirsteni",The Koryo Robo's ability to detect and diagnose an illness is limited by a lack of oxygen. The Koryo Robo's ability to detect and diagnose an illness is limited by a lack of oxygen. The Koryo Robo's ability to detect and diagnose an illness is limited by a lack of oxygen.
232,"Kirsti Kirstie, Kirstin Kirstyn, Kissee Kissiah, Kissie Kit, Kitti Kittie, Kitty Kizzee",It is not clear from the Times report whether it has provided any credible evidence for its suspicions.
233,"Kizzie Klara, Klarika Klarrisa, Konstance Konstanze, Koo Kora, Koral Koralle, Kordula Kore",Nucleic Acids - Thiaminone - Is Highly Sensitive to Phosphorylation of TGF-b
234,"Korella Koren, Koressa Kori, Korie Korney, Korrie Korry, Kourtney Kris, Krissie Krissy",The expression of CD44/eIF3 and CD71 in both primary human and microvascular endothelial cells is enhanced in a trans-9-kDa cell line
235,"Krista Kristal, Kristan Kriste, Kristel Kristen, Kristi Kristien, Kristin Kristina, Kristine Kristy",The Hero Link
236,"Kristyn Krysta, Krystal Krystalle, Krystle Krystyna, Kyla Kyle, Kylen Kylie, Kylila Kylynn",Asset use permission in mods/files that earn donation points You must get permission to earn Donation Points for your mods if they use my assets Author notes This author has not provided any additional notes regarding file permissions File credits This author has not credited anyone else in this file Donation Points system This mod is not opted-in to receive Donation Points
237,"Kym Kynthia, Kyrstin La, Lacee Lacey, Lacie Lacy, Ladonna Laetitia, Laila Laina",cmc_kills_bp(3) -cKlaxg2 -Dpk_Kills__ p+__c__k_P<__c__m__k__b__c_p___
238,"Lainey Lamb, Lana Lane, Lanette Laney, Lani Lanie, Lanita Lanna, Lanni Lanny","Under the Medicaid expansion, about 1.5 million people would benefit from the Affordable Care Act, which covers about 1.8 million people, according to the report from the Centers for Medicare and Medicaid Services."
239,"Lara Laraine, Lari Larina, Larine Larisa, Larissa Lark, Laryssa Latashia, Latia Latisha","The A-300 is a reliable, reliable,"
240,"Latrena Latrina, Laura Lauraine, Laural Lauralee, Laure Lauree, Laureen Laurel, Laurella Lauren",Proteinase-B Is a Member of the DNA-Binding Protein-Receptor Complex
241,"Laurena Laurene, Lauretta Laurette, Lauri Laurianne, Laurice Laurie, Lauryn Lavena, Laverna Laverne","Inhibition of L-ascorbylyl cyclase, a methylation-mediated pathway by MMP-2"
242,"Lavina Lavinia, Lavinie Layla, Layne Layney, Lea Leah, Leandra Leann, Leanna Leanne","The Orioles are also without left-handed pitcher Wily Peralta, who was with Kansas City, for the final six games."
243,"Leanor Leanora, Lebbie Leda, Lee LeeAnn, Leeann Leeanne, Leela Leelah, Leena Leesa",A novel novel methylmercury-mediated pathway allows for the generation and degradation of novel polyphenols and a novel polyphenol-specific gene
244,"Leese Legra, Leia Leiah, Leigh Leigha, Leila Leilah, Leisha Lela, Lelah Leland",C++11 Compiler Documentation
245,"Lelia Lena, Lenee Lenette, Lenka Lenna, Lenora Lenore, Leodora Leoine, Leola Leoline",1) Differential effects of different polysaccharides on colon tumorigenesis
246,"Leona Leonanie, Leone Leonelle, Leonie Leonora, Leonore Leontine, Leontyne Leora, Leorah Leshia",My department is currently printing more military information about its service members and manages to pay for their services.
247,"Lesley Lesli, Leslie Lesly, Lesya Leta, Lethia Leticia, Letisha Letitia, Letta Letti",Radoslaw was an instrumental part of a team that helped to bring down a suicide bomber in the eastern city of Zaventem and the subsequent attack in Zaventem in July 2015.
248,"Lettie Letty, Leyla Lezlie, Lia Lian, Liana Liane, Lianna Lianne, Lib Libbey","In other words, vegetarians are eating less meat and less fat than vegans, but they are less likely to have heart disease, cancer, and a range of other chronic conditions."
249,"Libbi Libbie, Libby Licha, Lida Lidia, Lil Lila, Lilah Lilas, Lilia Lilian","The domain ""adblock.com.msn.cn.slug.msmb"" appears to be a fake."
250,"Liliane Lilias, Lilith Lilla, Lilli Lillian, Lillis Lilllie, Lilly Lily, Lilyan Lin",The biggest problem with the US military is that it is not paying for its services. There is no way for us to keep our soldiers safe. We must do more to ensure that our military services are funded.
251,"Lina Lind, Linda Lindi, Lindie Lindsay, Lindsey Lindsy, Lindy Linea, Linell Linet","The good news is that we are not the only ones who are contributing to the dearth of vitamin D. As a result, the leading cause of oral cancer in women is the consumption of high-fat dairy products, such as high-fiber and high-sodium milk products, which are associated with a greater risk of developing glioblastoma and other cancers."
252,"Linette Linn, Linnea Linnell, Linnet Linnie, Linzy Liora, Liorah Lira, Lisa Lisabeth",I am no more lost or lost.
253,"Lisandra Lisbeth, Lise Lisetta, Lisette Lisha, Lishe Lissa, Lissi Lissie, Lissy Lita","The domain ""adblock.com.au"" appears to be a fake."
254,"Liuka Livia, Liz Liza, Lizabeth Lizbeth, Lizette Lizzie, Lizzy Loella, Lois Loise","""I have heard the message from my manager, Jurgen Klopp, but I am not ready to leave. At the moment I am not ready to play for Liverpool, but I am very happy for the club. I am ready to play for the club.""<|endoftext|>A Bunch of Twisted Potatoes, Cauliflower, and 7-Up Eggs"
255,"Lola Lolande, Loleta Lolita, Lolly Lona, Lonee Loni, Lonna Lonni, Lonnie Lora","The US-led invasion of Iraq and the subsequent US-led invasion of Afghanistan are leading the Islamic State to take territory in Iraq and Syria, and the US should prevent that from happening."
256,"Lorain Loraine, Loralee Loralie, Loralyn Loree, Loreen Lorelei, Lorelle Loren, Lorena Lorene","OpenMP-E Are OpenMP-E C++11 Compilers? This is a difficult question to answer, but I think it is a good post to answer."
257,"Lorenza Loretta, Lorettalorna Lorette, Lori Loria, Lorianna Lorianne, Lorie Lorilee, Lorilyn Lorinda",The Red Sox are without right-hander David Robertson.
258,"Lorine Lorita, Lorna Lorne, Lorraine Lorrayne, Lorri Lorrie, Lorrin Lorry, Lory Lotta","I am a mortal,"
259,"Lotte Lotti, Lottie Lotty, Lou Louella, Louisa Louise, Louisette Love, Luana Luanna","The Dark Portal is the final resting place of the Dark Shaper in this world, and the Dark Portal was a keystone that guided the Dark Lord through time and space."
260,"Luce Luci, Lucia Luciana, Lucie Lucienne, Lucila Lucilia, Lucille Lucina, Lucinda Lucine",ES2015-02-27T14:14:34+00:00<|endoftext|>The Best Place to Live in Alabama
261,"Lucita Lucky, Lucretia Lucy, Luella Luelle, Luisa Luise, Lula Lulita, Lulu Luna",The Orioles have acquired right-handed pitcher Josh Harrison from the Red Sox in exchange for right-handed pitcher Dimitrios Papadopoulos.
