,author,title
356,"Sal Sallee, Salli Sallie, Sally Sallyann, Sallyanne Salome, Sam Samantha, Samara Samaria","The Pope's address came on the same day as the US-led invasion of Iraq, as well as the US-led invasion of Afghanistan."
357,"Sammy Samuela, Samuella Sande, Sandi Sandie, Sandra Sandy, Sandye Sapphira, Sapphire Sara","The statement also says that the US had no links to the Taliban, but was seeking ""to prevent the delivery of weapons of mass destruction to the region,"" and ""intervened in a comprehensive, multilateral dialogue to prevent the delivery of biological, chemical and nuclear weapons to the opposition in order to prevent the spread of terrorism."""
358,"Sara-Ann Saraann, Sarah Sarajane, Saree Sarena, Sarene Sarette, Sari Sarina, Sarine Sarita",I know that I am alive.
359,"Sascha Sasha, Sashenka Saudra, Saundra Savina, Sayre Scarlet, Scarlett Scotty, Sean Seana",Trump's remarks have been met with fierce criticism from some in the Republican establishment.
360,"Secunda Seka, Sela Selena, Selene Selestina, Selia Selie, Selina Selinda, Seline Sella","A novel polyphenol-specific gene, MMP-80, regulates oxidative stress in murine melanoma cells"
361,"Selle Selma, Sena Sephira, Serena Serene, Shaina Shaine, Shalna Shalne, Shamit Shana","I've never really heard of a R9 280, but I've heard of a lot of other R9 280s and R9 280 2-in-1s, but I haven't seen a well-known name yet. Is there a way of vectoring the rattle from the original to the next, or are there some other ways of doing this?"
362,"Shanda Shandee, Shandie Shandra, Shandy Shane, Shani Shanie, Shanna Shannah, Shannen Shannon",The EIA is also required to determine the scope of any EIA-recommended changes to its energy policies. These changes will include:
363,"Shanon Shanta, Shantee Shara, Sharai Shari, Sharia Sharie, Sharity Sharl, Sharla Sharleen","I graduated Caltech from MIT with a degree in Biotechnology and the Bioengineering of Protein in 1994. In 2002, I accepted a position with a leading leading, global research university in Japan. As a result of my position I gained many prestigious awards, including the Nobel Prize for Physiology or Medicine, the European Distinguished Service Medal, the Nobel Peace Prize, the European Heart Foundation Olympic Prize, the European Foundation for Human-to-Human Transplantation, the European Society for the Protection of Human Life, the German and Japanese Agricultural Research Council, the European Society for the Protection of Human Life and Social Development, the European Society for the Protection of Animals and the European Society for the Prevention of Cruelty to Animals."
364,"Sharlene Sharline, Sharna Sharon, Sharona Sharra, Sharron Sharyl, Shaun Shauna, Shawn Shawna",STAT3 Is a Major Signaling Secretioner in the Human Genome and Is Transcriptional Activator of the BRCA1 and BRCA2 Subpopulations
365,"Shawnee Shay, Shayla Shaylah, Shaylyn Shaylynn, Shayna Shayne, Shea Sheba, Sheela Sheelagh","The Pope recently spoke at a meeting of the Forum for the Study of the Christian World, a non-governmental organization that promotes the development of a ""moral, scientific and ethical understanding of the conflict against the State of Palestine,"" according to the website."
366,"Sheelah Sheena, Sheeree Sheila, Sheila-Kathryn Sheilah, Sheilakathryn Shel, Shela Shelagh, Shelba Shelbi","And as his will to fight the evil Captain becomes more and more strong, the new Captain will become a stronger and more determined character."
367,"Shelby Shelia, Shell Shelley, Shelli Shellie, Shelly Shena, Sher Sheree, Sheri Sherie","Once again, the U.S. is leading the world in global growth, but the U.S. economy is facing a severe decline in U.S. jobs and interest rates."
368,"Sheril Sherill, Sherilyn Sherline, Sherri Sherrie, Sherry Sherye, Sheryl Shilpa, Shina Shir",Play Facebook
369,"Shira Shirah, Shirl Shirlee, Shirleen Shirlene, Shirley Shirline, Shoshana Shoshanna, Shoshie Siana","""It's hard to believe that any major news outlet would say anything about a political opponent of the president, or American-born Muslim women who have been kidnapped, tortured and murdered by the enemy,"" said Rep. Mick Mulvaney, R-S.C."
370,"Sianna Sib, Sibbie Sibby, Sibeal Sibel, Sibella Sibelle, Sibilla Sibley, Sibyl Sibylla",Criminalization of Financial Institutions
371,"Sibylle Sidoney, Sidonia Sidonnie, Sigrid Sile, Sileas Silva, Silvana Silvia, Silvie Simona",14-3-3-3-1-4 Isolated from
372,"Simone Simonette, Simonne Sindee, Sinead Siobhan, Sioux Siouxie, Sisely Sisile, Sissie Sissy",Caspase-1 Is a Protease in the Differential Effect of Different Epitaxel Dose-Sensitive Antigens in Normal and Orokin Hepatocellular Carcinoma Cells
373,"Sofia Sofie, Solange Sondra, Sonia Sonja, Sonni Sonnie, Sonnnie Sonny, Sonya Sophey",The caspase-1-dependent caspase-2 inhibits the self-incompatibility of the CCR5 gene and the TIMP-1-dependent caspase-2 in C. elegans
374,"Sophi Sophia, Sophie Sophronia, Sorcha Sosanna, Stace Stacee, Stacey Staci, Stacia Stacie",The central bank is not expected to raise rates until the end of the year.
375,"Stacy Stafani, Star Starla, Starlene Starlin, Starr Stefa, Stefania Stefanie, Steffane Steffi","A search of the Internet for the word ""advertisements"" leads to the following result:"
376,"Steffie Stella, Stepha Stephana, Stephani Stephanie, Stephannie Stephenie, Stephi Stephie, Stephine Stesha","The Orioles are also without left-handed reliever Ryan Zimmerman, who is with the Yankees, but the team is without right-handed pitcher Francisco Lindor, who is with the White Sox."
377,"Stevana Stevena, Stoddard Storey, Storm Stormi, Stormie Stormy, Sue Sue-elle, Suellen Sukey",The Bitfinex Bitcoin exchange Bitfinex China - New York
378,"Suki Sula, Sunny Sunshine, Susan Susana, Susanetta Susann, Susanna Susannah, Susanne Susette",It also adds a way to identify the path of the weapon by the type and angle of the scope.
379,"Susi Susie, Sussi Susy, Suzan Suzann, Suzanna Suzanne, Suzetta Suzette, Suzi Suzie","Promoting and conserving biodiversity, and reducing the potential for global sea level rise"
380,"Suzy Suzzy, Sybil Sybila, Sybilla Sybille, Sybyl Sydel, Sydelle Sydney, Sylvia Sylvie","On the Isle of Thunder, the Third Dragon Mountains, and the Island of Jotun"
381,"Tabatha Tabbatha, Tabbi Tabbie, Tabbitha Tabby, Tabina Tabitha, Taffy Talia, Tallia Tallie","11-1,5-Dioscorea Lactobacillus is a Cucurbita-Like Microbe, and Its Development Is In Host Invasion"
382,"Tally Talya, Talyah Tamar, Tamara Tamarah, Tamarra Tamera, Tami Tamiko, Tamma Tammara",The Ibravim Gene Is Proteins for Human Papilloma Development
383,"Tammi Tammie, Tammy Tamra, Tana Tandi, Tandie Tandy, Tani Tania, Tansy Tanya","I've always wanted a R9 270-style 3.5-in. version of the R9 270, but I've never seen a 3.5-in. version of the R9 270 in my life. Is the 3.5-in. R9 270 a good choice for a toolbox/semi-toolbox?"
384,"Tara Tarah, Tarra Tarrah, Taryn Tasha, Tasia Tate, Tatiana Tatiania, Tatum Tawnya","If you've ever wondered how a few boozy, sweet, and spicy ingredients can be combined into something great, then you've come to the right place."
385,"Tawsha Teane, Ted Tedda, Teddi Teddie, Teddy Tedi, Tedra Teena, Tella Teodora","The Federal Open Market Committee (FOMC), the U.S. government's central bank, was a leading proponent of U.S. Federal Reserve Bank of New York policy. In the absence of a credible policy response, the FOMC imposed a wide range of regulations and issued a series of instructions to the Federal Reserve Board and its member institutions."
386,"Tera Teresa, TeresaAnne Terese, Teresina Teresita, Teressa Teri, Teriann Terina, Terra Terri","I know that I am your land,"
387,"Terri-Jo Terrianne, Terrie Terry, Terrye Tersina, Teryl Terza, Tess Tessa, Tessi Tessie",whiteface
388,"Tessy Thalia, Thea Theada, Theadora Theda, Thekla Thelma, Theo Theodora, Theodosia Theresa",From Wowpedia
389,"Theresa-Marie Therese, Theresina Theresita, Theressa Therine, Thia Thomasa, Thomasin Thomasina, Thomasine Tia","since you are my home,"
390,"Tiana Tiena, Tierney Tiertza, Tiff Tiffani, Tiffanie Tiffany, Tiffi Tiffie, Tiffy Tilda",The Bitfinex exchange Bitfinex New York - New York
391,"Tildi Tildie, Tildy Tillie, Tilly Tim, Timi Timmi, Timmie Timmy, Timothea Tina","A Turkish police officer stands guard outside a Turkish police station in Istanbul November 8, 2007. REUTERS/Efkan Ala"
392,"Tine Tiphani, Tiphanie Tiphany, Tish Tisha, Tobe Tobey, Tobi Tobie, Toby Tobye","The Orioles are also without right-hitter Ivan Nova, who is with the Cubs from 2008-12. Nova was with the Yankees from 2008-12."
393,"Toinette Toma, Tomasina Tomasine, Tomi Tomiko, Tommi Tommie, Tommy Toni, Tonia Tonie",The UESP UPGRADES Primitive Encryption Primitive Encryption Primitive Encryption Primitive UESP UPGRADES Primitive Encryption Primitive UESP UPGRADES UESP UPGRADES Primitive UESP UPGRADES Primitive UESP UPGRADES UESP UPGRADES Primitive UESP UPGRADES UESP UPGRADES Primitive UESP UPGRADES UESP UPGRADES UESP UPGRADES Primitive UESP UPGRADES UESP UPGRADES Primitive UESP UPGRADES UESP UPGRADES UESP UPGRADES Primitive UESP UPGRADES UESP UPGR
394,"Tony Tonya, Tootsie Torey, Tori Torie, Torrie Tory, Tova Tove, Trace Tracee","To create a Project in Microsoft Office 365 or Office 365 Mobile, you must have an Office 365 Project. This means that you will need to download a free Office 365 Project for Windows Phone 8.1, or you will need to download a free Office 365 Project for Windows Phone 8.1. If you do not have a Project in Microsoft Office 365, you can download it for free from the Microsoft Store."
395,"Tracey Traci, Tracie Tracy, Trenna Tresa, Trescha Tressa, Tricia Trina, Trish Trisha","The central bank has raised interest rates in the wake of the June financial crisis, and the ECB has sent a team of economists to Europe to assess the impact of the European Central Bank's decision.<|endoftext|>In the last few days, the U.S. government has been beating up on the financial sector in a bid to control the cost of borrowing and stabilizing the economy, and one of the big drivers is the growth in U.S. companies."
396,"Trista Trix, Trixi Trixie, Trixy Truda, Trude Trudey, Trudi Trudie, Trudy Trula","Pope Francis spoke of the need to ""protect the peace"" by using violence and violence against the persecuted."
397,"Tuesday Twila, Twyla Tybi, Tybie Tyne, Ula Ulla, Ulrica Ulrika, Ulrike Umeko","The C++11 Compiler provides the C++11 Exporter, a direct replacement for the C++11 Compiler and a subset of the Exporter, for the C ++ Compiler."
398,"Una Ursa, Ursala Ursola, Ursula Ursulina, Ursuline Uta, Val Valaree, Valaria Vale","Since breast cancer cells are usually differentiated from healthy ones through the development of TGFb-1, B-lymphocytes are the primary target of early-stage breast cancer cell migration and tumor metastasis, leading to the development of a rapidly-growing, metastatic tumor."
399,"Valeda Valencia, Valene Valenka, Valentia Valentina, Valentine Valera, Valeria Valerie, Valery Valerye",THE BOMBETHEUS OF PULSE
400,"Valida Valina, Valli Vallie, Vally Valma, Valry Van, Vanda Vanessa, Vania Vanna","I believe that C++11-specific Exporter is a C++11-specific C++11-Specific Exporter, and as such, I think it is a C++11-specific Exporter."
401,"Vanni Vannie, Vanny Vanya, Veda Velma, Velvet Vena, Venita Ventura, Venus Vera",The DEA regulates a wide variety of different different drugs.
402,"Veradis Vere, Verena Verene, Veriee Verile, Verina Verine, Verla Verna, Vernice Veronica","The state's public health programs are underfunded. During the most recent fiscal year, the state made $17.8 billion in operating costs, and the state has a $1.9 trillion budget deficit."
403,"Veronika Veronike, Veronique Vi, Vicki Vickie, Vicky Victoria, Vida Viki, Vikki Vikkie",Ethanol-Based Protein Kinase
404,"Vikky Vilhelmina, Vilma Vin, Vina Vinita, Vinni Vinnie, Vinny Viola, Violante Viole",Kardashian from Koryo Robot
405,"Violet Violetta, Violette Virgie, Virgina Virginia, Virginie Vita, Vitia Vitoria, Vittoria Viv","Koryo Robot originated from an idea that the humanoid robots of the early Cold War era were used by the Soviets for military purposes. Koryo Robot was created by Oda in an effort to provide a viable successor to the Oda Robotics Corporation's Koryo robot. Koryo Robot was the first of a group of humanoid robots based on the Koryo robots that were created by the Oda Robotics Corporation. The Koryo robots produced by the Oda Robotics Corporation were a large number of the Koryo Robots that had recently been developed as unmanned aerial vehicles. In 1997, Oda did a short test drive of the Koryo robot near Tokyo and concluded that it would be superior to the Koryo Robotics Corporation's Koryo robots."
406,"Viva Vivi, Vivia Vivian, Viviana Vivianna, Vivianne Vivie, Vivien Viviene, Vivienne Viviyan","The Hero Link is the protagonist of Left 4 Dead 2. The Hero Link is a group of characters who are able to be linked by the player's actions, items, abilities, and decisions. Whether the Hero Link is a member of a group of characters or just a hero, the Hero Link is a leading force in the story of the game."
407,"Vivyan Vivyanne, Vonni Vonnie, Vonny Wallie, Wallis Wally, Waly Wanda, Wandie Wandis","This is a perfect opportunity to get a sense of the story of the most trafficked women in the world, and how a lot of the women are young, and there's a lot more demand than we've seen. Listen the podcast and learn more. In the meantime, here's a link for the others who are worried about the situation in Honduras."
408,"Waneta Wenda, Wendeline Wendi, Wendie Wendy, Wenona Wenonah, Whitney Wileen, Wilhelmina Wilhelmine","-The Arctic Ocean is being hit by a major warming trend with jet stream flows nearing record levels, according to a new study from the University of California, Santa Barbara."
409,"Wilie Willa, Willabella Willamina, Willetta Willette, Willi Willie, Willow Willy, Willyt Wilma",The Hero Heroes
410,"Wilmette Wilona, Wilone Wilow, Windy Wini, Winifred Winna, Winnah Winne, Winni Winnie",Tissues from the Nipponica-Tibetan Region Are Associated with Different Gene Avoids in Hemoglobin
411,"Winnifred Winny, Winona Winonah, Wren Wrennie, Wylma Wynn, Wynne Wynnie, Wynny Xaviera",Janssen (pictured in 2011) was the council president from 2006 to 2010 and was a member of the New York City Council for four years.
412,"Xena Xenia, Xylia Xylina, Yalonda Yehudit, Yelena Yetta, Yettie Yetty, Yevette Yoko","""I've been working on a lot of stuff for a while now, and you've been working on it for a while, and now that you've been working on it, you're starting to get excited about it,"" Belichick told FOX Sports on Thursday. ""It's new territory, and you start to see the benefits of it, and so it just sort of clicks into place, and I think it's a really good fit for the Patriots."""
413,"Yolanda Yolande, Yolane Yolanthe, Yonina Yoshi, Yoshiko Yovonnda, Yvette Yvonne, Zabrina Zahara","LAS VEGAS – In a new generation of pathogenic microbe, Escherichia coli O157:H7 Is an Endogenous Antigens"
414,"Zandra Zaneta, Zara Zarah, Zaria Zarla, Zea Zelda, Zelma Zena, Zenia Zia",Did you know you can have Fortis's Microbrewer's Choice Award for your favorite beer?
415,"Zilvia Zita, Zitella Zoe, Zola Zonda, Zondra Zonnya, Zora Zorah, Zorana Zorina","""The fact is that we are still eating a lot of meat, and we're still getting a lot of nutrients from that,"" says Dr. Axelrod. ""While we are still getting all the nutrients, we are not getting all the nutrients from the whole diet. Simply because we are eating a lot of meat, we are getting much less of the nutrients from that."""
416,"Zorine Zsa Zsa, Zsazsa Zulema, Zuzana Mikako, Kaari Gita, Geeta Aamir, Aaron Abbey",on •
417,"Abbie Abbot, Abbott Abby, Abdel Abdul, Abdulkarim Abdullah, Abe Abel, Abelard Abner","Over the past few years, we have become less able to support our families, and even more so when it comes to health care. The state has already paid for a projected $15 billion in new federal funding for health care in 2018."
418,"Abraham Abram, Ace Adair, Adam Adams, Addie Adger, Aditya Adlai, Adnan Adolf",A novel microRNA-8 regulates interleukin-8 expression and activity in the human rhabdomyosarcoma tumor
419,"Adolfo Adolph, Adolphe Adolpho, Adolphus Adrian, Adrick Adrien, Agamemnon Aguinaldo, Aguste Agustin","I'm a former UESP core developer and a member of the UESP-BASED Programmers, who recently joined the UESP-Team. UESP is a programming language developed and maintained by the UESP Foundation."
420,"Aharon Ahmad, Ahmed Ahmet, Ajai Ajay, Al Alaa, Alain Alan, Alasdair Alastair","Since the mid-1980s, the state has had a high rate of uninsured and lower-income residents. Today, the state has the highest percentage of uninsured residents in the nation. About half of the state's residents are in the bottom 5 percent of income."
421,"Albatros Albert, Alberto Albrecht, Alden Aldis, Aldo Aldric, Aldrich Aldus, Aldwin Alec","In C. elegans, the caspase-1-dependent caspase-2 is involved in colorectal cancer"
422,"Aleck Alejandro, Aleks Aleksandrs, Alessandro Alex, Alexander Alexei, Alexis Alf, Alfie Alfonse","The state's Medicaid program covers about 1.3 million people, the report says."
423,"Alfonso Alfonzo, Alford Alfred, Alfredo Algernon, Ali Alic, Alister Alix, Allah Allan","In July, the central bank increased the target to 3 percent from 2 percent, and the target is on hold until the Bundestag elections are held in early 2017."
424,"Allen Alley, Allie Allin, Allyn Alonso, Alonzo Aloysius, Alphonse Alphonso, Alston Alton","The U.S. official said Turkey has not yet agreed to the U.S. request that it build a base in the controversial area, even though it is ""long overdue for a comprehensive and well-coordinated effort to support the U.S.-led coalition in the fight against ISIL."""
425,"Alvin Alwin, Amadeus Ambros, Ambrose Ambrosi, Ambrosio Ambrosius, Amery Amory, Amos Anatol",Bitfinex Bitfinex New York - New York
426,"Anatole Anatollo, Anatoly Anders, Andie Andonis, Andre Andrea, Andreas Andrej, Andres Andrew",Bitfinex New York - New York
427,"Andrey Andri, Andros Andrus, Andrzej Andy, Angel Angelico, Angelo Angie, Angus Ansel",Magely Sacrifice
428,"Ansell Anselm, Anson Anthony, Antin Antoine, Anton Antone, Antoni Antonin, Antonino Antonio",L-Methylparabens Inhibitors Enzyme-Linked Antigens in Viral Pathogenic Escherichia coli
429,"Antonius Antony, Anurag Apollo, Apostolos Aram, Archibald Archibold, Archie Archon, Archy Arel",The Evolutionary Hypothesis of the
430,"Ari Arie, Ariel Aristotle, Arlo Armand, Armando Armond, Armstrong Arne, Arnie Arnold","Kodak, an Indian conglomerate, has agreed to purchase a new plant in Vancouver Island, Canada, that produces as much as one-fifth of the world's lithium-ion batteries, as the company develops a new battery to replace the old lead-acid batteries in the US and Europe, said the company in a statement."
431,"Arnoldo Aron, Arron Art, Arther Arthur, Artie Artur, Arturo Arvie, Arvin Arvind",Borrowing a C++11 C++11 Reference
432,"Arvy Ash, Ashby Ashish, Ashley Ashton, Aub Aube, Aubert Aubrey, Augie August","The family of the No 4 target, Radoslaw, told the Belgian media on Monday that the families are in the process of arranging a meeting between the suspects in the Brussels attack."
433,"Augustin Augustine, Augusto Augustus, Austen Austin, Ave Averell, Averil Averill, Avery Avi",Multiple sclerosis (MS) induces a suppression of the growth of CD44 growth factor-1-dependent macrophages by a novel polypeptide
434,"Avraham Avram, Avrom Axel, Aylmer Aziz, Bailey Bailie, Baillie Baily, Baird Baldwin","""We think this may be due to a new type of ocean acidification and thus an increase in the jet stream's circulation,"" he added."
435,"Bancroft Barbabas, Barclay Bard, Barde Barn, Barnabas Barnabe, Barnaby Barnard, Barnebas Barnett","The A-300 is designed to be good at firing at close range, but not at long range. The A-300 is designed to be good at firing at close range, but not at long range."
436,"Barney Barnie, Barny Baron, Barr Barret, Barrett Barri, Barrie Barris, Barron Barry","The Orioles are currently without right-handed pitcher Raul Mondesi and right-handed pitcher Craig Kimbrel. They are also without right-handed pitcher Dexter Fowler, who is with the Yankees."
437,"Bart Bartel, Barth Barthel, Bartholemy Bartholomeo, Bartholomeus Bartholomew, Bartie Bartlet, Bartlett Bartolemo",A new ad appears for a new product on the website of a US-based company.
438,"Bartolomei Bartolomeo, Barton Barty, Bary Basil, Batholomew Baxter, Bay Bayard, Beale Bealle",The state's economic growth has slowed markedly in recent years.
439,"Bear Bearnard, Beau Beaufort, Beauregard Beck, Bela Ben, Benedict Bengt, Benito Benjamen","Trump's comment came during an interview with Fox News host Sean Hannity, and the president was asked later whether he thought the paper was biased against him for calling him an ""enemy of the American people."""
440,"Benjamin Benji, Benjie Benjy, Benn Bennet, Bennett Bennie, Benny Benson, Bentley Benton","So, a single drug can have multiple rivendelling properties. The FDA regulates one drug. The FDA regulates up to five different types of drugs."
441,"Beowulf Berchtold, Berk Berke, Berkeley Berkie, Berkley Bernard, Bernardo Bernd, Bernhard Bernie",I have been forced to have a personal life and to have a family of my own. I have been forced to have a home where I can have child-bearing options that are open to all of my family. I have been forced to have a home where I can have a career that is simply not for me. I have been forced to have a home where I can have a family that is simply not for me.
442,"Bert Bertie, Bertram Bertrand, Bharat Biff, Bill Billie, Billy Bing, Binky Bishop",Ethanol and the cannabinoid system cross-talk in the human colon
443,"Bjorn Bjorne, Blaine Blair, Blake Blare, Blayne Bo, Bob Bobbie, Bobby Bogart","Families of Apoptosis Cell-Derived Monosodium Triglycerides Are Associated with Lung Injury, Coronavirus Infection, and Related Diseases"
444,"Bogdan Boniface, Boris Boyce, Boyd Brad, Braden Bradford, Bradley Bradly, Brady Brandon","If you're planning on attending a concert, you can join the music tasting room for the free beer tasting. The tasting room is available for everyone who is interested.<|endoftext|>The US government's plan to cut the number of military personnel in the US is largely a fluke."
445,"Brandy Brant, Brendan Brent, Bret Brett, Brewer Brewster, Brian Brice, Briggs Brinkley",The primary role of a weekly party is to mobilize the masses
446,"Britt Brock, Broddie Broddy, Broderic Broderick, Brodie Brody, Bronson Brook, Brooke Brooks",The military has always been a very important part of the US military.
447,"Bruce Bruno, Bryan Bryant, Bryce Bryn, Bryon Bubba, Buck Bucky, Bud Buddy","Janssen's former city clerk, Jodi Rauch, was elected to the Council in 2012 and has served as a spokesperson for the mayor's campaign."
448,"Burgess Burke, Burl Burnaby, Burt Burton, Buster Butch, Butler Byram, Byron Caesar","As such, the new Captain will become a stronger and more determined character and will take on a new role in order to defeat the evil Captain and save the world."
449,"Cain Cal, Caldwell Caleb, Calhoun Calvin, Cam Cameron, Cammy Carey, Carl Carleigh","Kodak and U-K are leading the new generation of lithium-ion cells, which are expected to help meet the needs of electric vehicles and the growth of self-driving cars, said Lipin Tang, a senior solar scientist at the US National Renewable Energy Laboratory in Boulder, Colorado."
450,"Carlie Carlin, Carlo Carlos, Carlton Carlyle, Carmine Carroll, Carson Carsten, Carter Cary","The suspect fled the scene through a back door and was later taken into custody, officials said.<|endoftext|>It's the face of the 21st century, but the moment is not right for the New York City Council."
451,"Caryl Case, Casey Caspar, Casper Cass, Cat Cecil, Cesar Chad, Chadd Chaddie","I believe that OpenMP-E is a C++11-specific Exporter, and OpenMP-E Is a C++11-Specific Exporter."
452,"Chaddy Chadwick, Chaim Chalmers, Chan Chance, Chancey Chanderjit, Chandler Chane, Chariot Charles",The report says the Medicaid expansion will help offset the cost of insurance premiums for low-income Americans.
453,"Charleton Charley, Charlie Charlton, Chas Chase, Chaunce Chauncey, Che Chelton, Chen Chester","Today, the DEA is required to do a third of its job, and if the agency fails to do its job, it is subject to a fine from the DEA. This fine is based on the FDA's involvement in the drug industry."
454,"Cheston Chet, Chev Chevalier, Chevy Chip, Chris Chrissy, Christ Christian, Christiano Christie","The electoral system is not a ""party"" or a movement. It is a movement and its members are not a political party or a movement. They are a peer group of people that are participating in a movement on a public level, and they are participating in a movement on a national level. The primary role of a weekly party is to mobilize the masses and to build the movement on the national level."
455,"Christof Christofer, Christoph Christophe, Christopher Christorpher, Christos Christy, Chrisy Chuck, Churchill Clair","In the United States, a combination of rising incomes, a stagnant economy, and a concentrated wealth-based economy are driving the U.S. economy to a near-deficits plateau. The U.S. has the largest deficit in the world and a poor infrastructure, but the U.S. economy is growing at a slow pace and the cost of production in the U.S. is lower"
456,"Claire Clancy, Clarance Clare, Clarence Clark, Clarke Claude, Claudio Claudius, Claus Clay","The UESP (Universal Serialization Protocol) Library is a fully interoperable, open source UESP UPGRADES library, maintained by the UESP Foundation. UESP UPGRADES is a cross-platform, in-house UPGRADES library, maintained by the UESP Foundation."
