,author,title
92,"Coriss Corissa, Corliss Corly, Cornela Cornelia, Cornelle Cornie, Corny Correna, Correy Corri","Asset use permission in mods/files that are being sold You are not allowed to use assets from this file in any mods/files that are being sold, for money, on Steam Workshop or other platforms"
93,"Corrianne Corrie, Corrina Corrine, Corrinne Corry, Cortney Cory, Cosetta Cosette, Courtenay Courtney","I believe that OpenMP-E C++11-Specific Exporter is a C++11-Specific Exporter, and OpenMP-E Is a C++11-Specific Exporter."
94,"Cresa Cris, Crissie Crissy, Crista Cristabel, Cristal Cristen, Cristi Cristie, Cristin Cristina",cmc_clear_cputime: Regions with OpenCV - OpenCV
95,"Cristine Cristionna, Cristy Crysta, Crystal Crystie, Cyb Cybal, Cybel Cybelle, Cybil Cybill","Burns, who has played in all 88 of Liverpool's Premier League fixtures, is set to depart on a season-long loan with the Reds after an injury-plagued season for the England Under-21 team."
96,"Cyndi Cyndy, Cynthea Cynthia, Cynthie Cynthy, Dacey Dacia, Dacie Dacy, Dael Daffi","To the Editor: This story is a bit surprising, but the timing and content is wrong. A year after the collapse of Lehman Brothers, bank regulators are attempting to halt the impact of the Great Recession. Their goal is to prevent a similar phenomenon from occurring in the future."
97,"Daffie Daffy, Dafna Dagmar, Dahlia Daile, Daisey Daisi, Daisie Daisy, Dale Dalenna",A pilot-controlled trial of a novel cannabinoid-induced hepatocellular carcinogenicity in human volunteers exposed to a novel phytocannabinoid-induced oral administration
98,"Dalia Dalila, Dallas Daloris, Damara Damaris, Damita Dana, Danell Danella, Danelle Danette","I believe that the C++11-specific Exporter for C++11 is C++11-specific Exporter, and OpenMP is a C++11-specific Exporter."
99,"Dani Dania, Danica Danice, Daniel Daniela, Daniele Daniella, Danielle Danika, Danila Danit",IMPORTANCE:
100,"Danita Danna, Danni Dannie, Danny Dannye, Danya Danyelle, Danyette Daphene, Daphna Daphne","The US-led invasion of Iraq and the subsequent US-led invasion of Afghanistan are committing war crimes, and the US should end them."
101,"Dara Darb, Darbie Darby, Darcee Darcey, Darci Darcie, Darcy Darda, Dareen Darell",Promoting human-induced coral bleaching and other degradation-related bleaching events through enhanced reefs and other protected areas
102,"Darelle Dari, Daria Darice, Darla Darleen, Darlene Darline, Darryl Darsey, Darsie Darya","""The US-led invasion of Iraq and the subsequent US-led invasion of Afghanistan are leading the Islamic State to take territory in Iraq and Syria, and the US should prevent that from happening."""
103,"Daryl Daryn, Dasha Dasi, Dasie Dasya, Datha Daune, Daveen Daveta, Davida Davina",cmc_get_key_sig: Get_Key_sig_sig
104,"Davine Davita, Dawn Dawna, Dayle Dayna, Dea Deana, Deane Deanna, Deanne Deb","In a slave relationship, the slave's spouse/partner is the slave's spouse/partner's spouse/partner's spouse/partner's spouse/partner's spouse/partner's spouse/partner's spouse/partner's spouse/partner's spouse/partner's spouse/partner's spouse/partner's spouse/partner's spouse/partner's spouse/partner's spouse/partner's spouse/partner's spouse/partner's spouse/partner's spouse/partner's spouse/partner's spouse/partner's spouse/partner's spouse/partner's spouse/partner's spouse/partner's spouse/partner's spouse/partner's spouse/partner's spouse/partner's spouse/partner's spouse/partner's spouse/partner's spouse/partner's spouse/partner's spouse/partner's spouse/partner's spouse/partner's spouse/partner's spouse/partner's spouse/partner's spouse/partner's spouse/partner's spouse/partner's"
105,"Debbi Debbie, Debbra Debby, Debee Debera, Debi Debor, Debora Deborah, Debra Dede",In 2014
106,"Dedie Dedra, Dee Dee Dee, Deeann Deeanne, Deedee Deena, Deerdre Dehlia, Deidre Deina","The DEA regulates the sale of heroin and opioid pills, but the drug is not regulated by the FDA."
107,"Deirdre Del, Dela Delaney, Delcina Delcine, Delia Delila, Delilah Delinda, Dell Della",by Genevieve Krotzman
108,"Delly Delora, Delores Deloria, Deloris Delphina, Delphine Delphinia, Demeter Demetra, Demetria Demetris",14-3-13-7200.1.13-15.cip.10030.x Is a Novel Nucleotides-Backed Viral Gene
109,"Dena Deni, Denice Denise, Denna Denni, Dennie Denny, Deny Denys, Denyse Deonne",But there is a problem with that.
110,"Desaree Desdemona, Desirae Desiree, Desiri Deva, Devan Devi, Devin Devina, Devinne Devon","The state's medical marijuana program is a huge contributor to the state's diabetes epidemic. In 2014, the state operated a single-payer system, but by the end of 2014, that system was shut down."
111,"Devondra Devonna, Devonne Devora, Dew Di, Diahann Diamond, Dian Diana, Diandra Diane","The Orioles are also without right-handed reliever Yoan Moncada, who is with the Giants. Moncada has a 2.37 ERA and a .913 OPS over his last three starts with Kansas City."
112,"Diane-Marie Dianemarie, Diann Dianna, Dianne Diannne, Didi Dido, Diena Dierdre, Dina Dinah","As such, the newly formed Captain."
113,"Dinnie Dinny, Dion Dione, Dionis Dionne, Dita Dix, Dixie Dode, Dodi Dodie","Over time, he will become more and more independent, and will become more and more determined to fight the villainous alien resistance."
114,"Dody Doe, Doll Dolley, Dolli Dollie, Dolly Dolora, Dolores Dolorita, Doloritas Dominica",The Orioles are also without right-hander Stephen Gostisbehere.
115,"Dominique Dona, Donella Donelle, Donetta Donia, Donica Donielle, Donna Donnajean, Donnamarie Donni","The Muzzle Velocity (MV) is the idea that with the right ammunition you can kill a target by kicking them in the chest with the right trigger. In the US, the MV is 1.4 meters, and the MV is 1.55 meters. The MV has a muzzle velocity of 1/10,000ths of a second. In the US, it is 1.4 meters, and the MV is 1.55 meters."
116,"Donnie Donny, Dora Doralia, Doralin Doralyn, Doralynn Doralynne, Dorcas Dore, Doreen Dorelia","3,000%"
117,"Dorella Dorelle, Dorena Dorene, Doretta Dorette, Dorey Dori, Doria Dorian, Dorice Dorie",The cephalobranchs of the cephalopod family are involved in the pathogenesis of colon cancer
118,"Dorine Doris, Dorisa Dorise, Dorit Dorita, Doro Dorolice, Dorolisa Dorotea, Doroteya Dorothea",TAMPA — Police said they are investigating a shooting in the Saint Louis neighborhood of Target.
119,"Dorothee Dorothy, Dorree Dorri, Dorrie Dorris, Dorry Dorthea, Dorthy Dory, Dosi Dot","""I am ready to go and play in the Premier League and I want to win trophies. At the moment I am in the second tier and I am not a small player. I know that I can play a big part in the Premier League."
120,"Doti Dotti, Dottie Dotty, Dove Drea, Drew Dulce, Dulcea Dulci, Dulcia Dulciana","C. elegans isolated from chrysotile asbestos (E. asbestos) and associated with salmonella enterica-grinding proteins inhibits the self-incompatibility of TIMP-1, CCR5 and CCR7"
121,"Dulcie Dulcine, Dulcinea Dulcy, Dulsea Dusty, Dyan Dyana, Dyane Dyann, Dyanna Dyanne","The domain ""adblock.com.msn.ptp.pla"" appears to be a fake."
122,"Dyna Dynah, E'Lane Eada, Eadie Eadith, Ealasaid Eartha, Easter Eba, Ebba Ebonee","The researchers found that vegetarians are less likely than vegans to have diabetes, colon cancer, and high blood pressure, compared to nonvegetarians."
123,"Ebony Eda, Eddi Eddie, Eddy Ede, Edee Edeline, Eden Edi, Edie Edin","20,000%"
124,"Edita Edith, Editha Edithe, Ediva Edna, Edwina Edy, Edyth Edythe, Effie Eileen","10-1,3-Trimethylhexylglycine Hydrochloride Is A New Type Of Lipid-Regulating Lipoprotein"
125,"Eilis Eimile, Eirena Ekaterina, Elaina Elaine, Elana Elane, Elayne Elberta, Elbertina Elbertine","2,000%"
126,"Eleanor Eleanora, Eleanore Electra, Elena Elene, Eleni Elenore, Eleonora Eleonore, Elfie Elfreda",Janssen ran for the U.S. Senate on a platform of cutting taxes and a promise to make the city a more affordable and healthy place to live. He is also a member of the Board of Supervisors.
127,"Elfrida Elfrieda, Elga Elianora, Elianore Elicia, Elie Elinor, Elinore Elisa, Elisabet Elisabeth",The military is a national government and we are all entitled to the same information.
128,"Elisabetta Elise, Elisha Elissa, Elita Eliza, Elizabet Elizabeth, Elka Elke, Ella Elladine","The UESP UPGRADES Complexity Checker is a fully functional, open-source UESP UPGRADES library, maintained by the UESP Foundation. UESP UPGRADES is a cross-platform, in-house UPGRADES library, maintained by the UESP Foundation."
129,"Elle Ellen, Ellene Ellette, Elli Ellie, Ellissa Elly, Ellyn Ellynn, Elmira Elna","The Crossing starts out with a small town called The Crossing, which has been under constant attack by the evil town's new leader, the Captain. The Captain has been outfilmed and the town is now on the brink of extinction due to the use of a virus by the locals."
130,"Elnora Elnore, Eloisa Eloise, Elonore Elora, Elsa Elsbeth, Else Elsey, Elsi Elsie",A novel gene encoding a novel cyclooxygenase-3 protein regulates cell cycle-associated protein release in apoptotic and cancer-associated macrophages
131,"Elsinore Elspeth, Elsy Elva, Elvera Elvina, Elvira Elwina, Elwira Elyn, Elyse Elysee",The effect of Bovine Papilloma Virus Infection on Nerve Cell Function
132,"Elysha Elysia, Elyssa Em, Ema Emalee, Emalia Emanuela, Emelda Emelia, Emelina Emeline","A novel mechano-chemical pathway by which methylmercury-mediated oxidative stress, a potential cancer-promoting agent, induces apoptosis in Escherichia coli"
133,"Emelita Emelyne, Emera Emilee, Emili Emilia, Emilie Emiline, Emily Emlyn, Emlynn Emlynne","My research in the field of bioethics has led me to the conclusion that the use of extra-virgin olive oil as a topical niacin agent is not ethically justified. In the US, the FDA is involved in a number of regulatory actions against ethyl-dioscorel-A (EDA) but, under the correct labeling, the ECA is not a dietary ingredient. In my view, this is an unlawful and harmful policy."
134,"Emma Emmalee, Emmaline Emmalyn, Emmalynn Emmalynne, Emmeline Emmey, Emmi Emmie, Emmy Emmye",(Koryo Robot) - AKA: Koryo Robot
135,"Emogene Emyle, Emylee Endora, Engracia Enid, Enrica Enrichetta, Enrika Enriqueta, Enya Eolanda","The EIA has also undertaken an evaluation of the power technologies that are required to meet the energy security and stability requirements of the US energy security system. The report is required to assess the potential of an advanced, modular, and cost effective US energy security system, with its ability to control and respond to changing technologies, to reduce the cost of power generation and production."
136,"Eolande Eran, Erda Erena, Erica Ericha, Ericka Erika, Erin Erina, Erinn Erinna","If you want to be a part of a group meeting to discuss a topic, you can join the group for a private beer tasting. The tasting room is available for everyone who wants to join."
137,"Erma Ermengarde, Ermentrude Ermina, Erminia Erminie, Erna Ernaline, Ernesta Ernestine, Ertha Eryn","The Koryo Robot will be able to detect and field test human pathogens. The Koryo Robot will be able to detect and field test a variety of cold-blooded pathogens such as bacteria, viruses, worms and fungi. The Koryo Robot's ability to detect and diagnose an illness is limited by a lack of oxygen. The Koryo Robot's ability to detect and diagnose a disease is limited by a lack of oxygen."
138,"Esma Esmaria, Esme Esmeralda, Esmerelda Essa, Essie Essy, Esta Estel, Estele Estell","I have not been able to find a C++11 source code for the C++11 Compiler, but I have heard of C++11-specific C++11 code written by a number of different developers. This C++11 Compiler is a C++11-specific C++11 Compiler."
139,"Estella Estelle, Ester Esther, Estrella Estrellita, Ethel Ethelda, Ethelin Ethelind, Etheline Ethelyn",The Battle for Jotun's Heart
140,"Ethyl Etta, Etti Ettie, Etty Eudora, Eugenia Eugenie, Eugine Eula, Eulalie Eunice","The U.S. Federal Reserve System has been in a state of financial crisis for decades. In 2015, the U.S. Federal Reserve System, with the support of the Federal Open Market Committee, issued the $1.3 trillion Limit on Quantitative Easing, the New York Fed's central monetary policy instrument. The central bank's decision to limit the QE program to the U.S. and its exposed markets limited the central bank's ability to adequately stimulate the economy. In response, the U.S. Federal Reserve Board instituted policy to regulate the financial sector."
141,"Euphemia Eustacia, Eva Evaleen, Evangelia Evangelin, Evangelina Evangeline, Evania Evanne, Eve Eveleen","The New York Times published a statement from the Times on Wednesday morning, saying: ""The US Department of Justice and the Director of National Intelligence have concluded that the killing of a U.S. citizen by a drone in Pakistan in 2004 was a terrorist act that was motivated by a desire to prevent the US-led coalition from developing a nuclear-armed neighbor."""
142,"Evelina Eveline, Evelyn Evette, Evey Evie, Evita Evonne, Evvie Evvy, Evy Eyde",A new ad for a new product appears on the website of a California-based company.
143,"Eydie Fabrianne, Fabrice Fae, Faina Faith, Fallon Fan, Fanchette Fanchon, Fancie Fancy","The European Central Bank's policy decision to raise interest rates on its 7.5-billion-euro ($9.3-billion) debt is the latest in a long line of moves by the ECB to raise interest rates, in line with a series of European-wide policy decisions it launched in May."
144,"Fanechka Fania, Fanni Fannie, Fanny Fanya, Fara Farah, Farand Farica, Farra Farrah",12-2-3-3-1 Isolated From Droscorea gigas Proteins Could Modulate the Antigenicity of Droscorea
145,"Farrand Fatima, Faun Faunie, Faustina Faustine, Fawn Fawna, Fawne Fawnia, Fay Faydra",The cost of providing the information for the military is going to increase by over $1 billion a year.
146,"Faye Fayette, Fayina Fayre, Fayth Faythe, Federica Fedora, Felecia Felicdad, Felice Felicia","I believe that C++11-specific Exporter is a C++11-specific Exporter, and OpenMP is a C++11-specific Exporter."
147,"Felicity Felicle, Felipa Felisha, Felita Feliza, Fenelia Feodora, Ferdinanda Ferdinande, Fern Fernanda","Asked about the Times' coverage of the U.S.-Pakistani war, Trump said, ""I don't know. I wouldn't know."""
148,"Fernande Fernandina, Ferne Fey, Fiann Fianna, Fidela Fidelia, Fidelity Fifi, Fifine Filia",Here's a video tutorial on how to create a simple MASSIVE REST API with the UESP Wiki API
149,"Filide Filippa, Fina Fiona, Fionna Fionnula, Fiorenze Fleur, Fleurette Flo, Flor Flora","The No 5 target in the Brussels attack, Sayfullo Saipov, was a member of the No 5 team who was on the plane with the No 8 and No 10, and was regularly present during the investigation.<|endoftext|>The UESPWiki – Your source for The Elder Scrolls since 1995"
150,"Florance Flore, Florella Florence, Florencia Florentia, Florenza Florette, Flori Floria, Florice Florida",Activation of the NF-_B Subunit of the Human Epithelial Cells Promotes Their Neurogenesis
151,"Florie Florina, Florinda Floris, Florri Florrie, Florry Flory, Flossi Flossie, Flossy Flower","I took the Ziploc to the vets and they told me that the microchips are a sign of Alzheimer's disease. They are much more likely to cause permanent blindness in healthy people. I want to know how much better my baby's diet is compared to mine, and what are the potential benefits of a diet low in animal products (e.g. thiaminoprodol)?"
152,"Fortuna Fortune, Fran France, Francene Frances, Francesca Francesmary, Francine Francis, Francisca Franciska","The mutation is induced by the growth and differentiation of human psilocin, a key regulator of cell proliferation and differentiation in early life. In contrast, the LD50 mutation in the human CART1/2/3/4/5-knot gene is associated with reduced cell proliferation and apoptosis in vitro, and the HLA-CRCA2R mutation is associated with decreased cell proliferation and reactive oxygen species resistance in Escherichia coli. These mechanisms are enhanced by a mutation in the BRCA1/2RpR-dependent TrkB/STAT3/6a/7a/8/9b-ribonucleoprotein. In addition, the RNAs in the human bronchodilator gland and lung epithelial cells show decreased activity, while the surface area of the interleukin-9 is reduced in the bronchodilator gland compared with the lung epithelial cells. In contrast, the TGFb/AChR2b/TNF-bakb/AchR2b-dependent pathways in the interleukin-1b/c/elytic enzyme mediate the pathogenesis of patients with rheumatoid arthritis, renal nephropathy, rheumatoid arthritis nephropathy, and rheumatoid arthritis nephropathy. The interaction of MEKG mutations with the BRCA1/2RpR-dependent pathway in the ovis- and -visa barrier is associated with reduced inflammatory mediators in TNF-a mice. In vivo, MEKG-mediated gene expression in perinatal and/or early postnatal human bronchodilator-gland cells is enhanced by a mutation in the MAPK-dependent pathway in the CD14-deficient murine model of nephropathy. In a separate animal model, MEKG overexpression in asthma-associated nephropathy cells induces IL-8 activation and inhibits NF-__B activation in murine ischemia"
153,"Francoise Francyne, Frank Frankie, Franky Franni, Frannie Franny, Frayda Fred, Freda Freddi","The domain ""adblock.com"" appears to be a fake."
154,"Freddie Freddy, Fredelia Frederica, Fredericka Fredi, Fredia Fredra, Fredrika Freida, Frieda Friederike","The Aerolite A-300 is the most common type of barrel used by NATO air forces. It is mounted on a solid top plate and is made of a very thin layer of steel and is exposed to direct heat and gas from the engine. The A-300 is a very versatile barrel. Its primary function is to protect key components of the weapon system from heat and gas. It is a critical component of the anti-personnel and anti-access and anti-tank rocket systems. It is also a critical component of the anti-tank missile system, and is a critical component of the surface-to-air missile system. It is a critical component of the ballistic missile system."
155,"Fulvia Gabbey, Gabbi Gabbie, Gabey Gabi, Gabie Gabriel, Gabriela Gabriell, Gabriella Gabrielle","The Medicaid expansion will also help offset inflationary pressures on the federal government's budget, the report says."
156,"Gabriellia Gabrila, Gaby Gae, Gael Gail, Gale Gale , Galina Garland, Garnet Garnette","I know the R9 270 is a bit small, but I've always felt that the R9 270 is a bit too small for my liking. Is there anything I can do to make it smaller, or is the R9 270 just too small?"
157,"Gates Gavra, Gavrielle Gay, Gayla Gayle, Gayleen Gaylene, Gaynor Gelya, Gen Gena",The cephalobranchs of the cephalopod family are involved in the pathogenesis of nephropathy and nephropathy in rats
158,"Gene Geneva, Genevieve Genevra, Genia Genna, Genni Gennie, Gennifer Genny, Genovera Genvieve",Twitter
159,"George Georgeanna, Georgeanne Georgena, Georgeta Georgetta, Georgette Georgia, Georgiamay Georgiana, Georgianna Georgianne",STIM: Antigen-Targeting Tissues in Viral Hepatitis
160,"Georgie Georgina, Georgine Gera, Geralda Geraldina, Geraldine Gerda, Gerhardine Geri, Gerianna Gerianne","If you're not a member of the bar or are interested in attending the tasting, you can sign up for a free trial to take advantage of the free start."
161,"Gerladina Germain, Germaine Germana, Gerri Gerrie, Gerrilee Gerry, Gert Gerta, Gerti Gertie","At the same time, he will begin to wear the new uniform and make a new name for himself."
162,"Gertrud Gertruda, Gertrude Gertrudis, Gerty Giacinta, Giana Gianina, Gianna Gigi, Gilberta Gilberte",Ammunition
163,"Gilbertina Gilbertine, Gilda Gill, Gillan Gilli, Gillian Gillie, Gilligan Gilly, Gina Ginelle","In fact, according to a new study, vegetarians are about four times more likely to suffer from heart disease and cancer than vegans — and more likely to have cancer than nonvegetarians."
164,"Ginevra Ginger, Ginni Ginnie, Ginnifer Ginny, Giorgia Giovanna, Gipsy Giralda, Gisela Gisele",The caspase-1-dependent caspase-2 regulates the self-incompatibility of CCR5
165,"Gisella Giselle, Gizela Glad, Gladi Gladis, Gladys Gleda, Glen Glenda, Glenine Glenn",A Novel Mechanism Associated with Lipid Differentiation in the Human Body
166,"Glenna Glennie, Glennis Glori, Gloria Gloriana, Gloriane Glorianna, Glory Glyn, Glynda Glynis","""I think it's a disgrace that the New York Times is being used as a propaganda tool by the president,"" said Rep. Ron Paul, R-Texas. ""This is a political campaign, and it's a political issue. It's a political issue. It's a political issue. It's a political issue. If the story is completely false, then my colleagues and I would like to see a retraction. Look, I am a Republican and I vote for our party."""
167,"Glynnis Godiva, Golda Goldarina, Goldi Goldia, Goldie Goldina, Goldy Grace, Gracia Gracie",The jet stream's core circulation is currently at its lowest point on record.
168,"Grata Gratia, Gratiana Gray, Grayce Grazia, Gredel Greer, Greta Gretal, Gretchen Grete",9-3-2013: The Human Monoclonal Strain Gene Is Enriched with High Levels of High-Aging Human Immunodeficiency Virus
169,"Gretel Grethel, Gretna Gretta, Grier Griselda, Grissel Guendolen, Guenevere Guenna, Guglielma Gui","In fact, in 2011, the Drug Enforcement Administration stopped more than 1,600 drugs purchased from Mexico. The Bureau of Narcotics and Dangerous Drugs (BND)."
170,"Guillema Guillemette, Guinevere Guinna, Gunilla Gunvor, Gus Gusella, Gussi Gussie, Gussy Gusta","The US government has denied the claims, and the US is not in a position to investigate the claim."
171,"Gusti Gustie, Gusty Gwen, Gwendolen Gwendolin, Gwendolyn Gweneth, Gwenette Gwenn, Gwenneth Gwenni","I believe that OpenMP-E is a C++11-specific Exporter, and OpenMP is a C++11-specific Exporter."
172,"Gwennie Gwenny, Gwenora Gwenore, Gwyn Gwyneth, Gwynne Gypsy, Hadria Hailee, Haily Haleigh","Janssen's campaign website also features a photograph of him with a pair of New York City police officers.<|endoftext|>The New York Times is reporting that after the death of the actor, Stephen Baldwin, the Times released a statement saying:"
173,"Halette Haley, Hali Halie, Halimeda Halley, Halli Hallie, Hally Hana, Hanna Hannah",I am
174,"Hanni Hannibal, Hannie Hannis, Hanny Happy, Harlene Harley, Harli Harlie, Harmonia Harmonie","The US military has always struggled with this problem. Although the US military is small, it has always been a very large and important part of the US military."
175,"Harmony Harri, Harrie Harriet, Harriett Harrietta, Harriette Harriot, Harriott Hatti, Hattie Hatty","Alabama's Medicaid program is the nation's largest single program for low-income clients living in the state. About one in four Alabama Medicaid patients are in the public system. In addition, Alabama's Medicaid program runs into problems in the form of long waits and low access to care."
176,"Havivah Hayley, Hazel Heath, Heather Heda, Hedda Heddi, Heddie Hedi, Hedvig Hedwig",CRISPR-Cas and Its Use Is Required for the Generation of a New Type of Gene-editing Gene Fusion Replication System for the Human Genome and the Spine
177,"Hedy Heida, Heide Heidi, Heidie Helaina, Helaine Helen, Helen-Elizabeth Helena, Helene Helga",11:39 p.m.
178,"Helge Helise, Hellene Helli, Heloise Helsa, Helyn Hendrika, Henka Henrie, Henrieta Henrietta",A novel microRNA-Coded RNAs-RxR and RNAs-RxR regulate interleukin-1-dependent signalling in the human melanoma
179,"Henriette Henryetta, Hephzibah Hermia, Hermina Hermine, Herminia Hermione, Herta Hertha, Hester Hesther","As we get closer to the end of the story, we see that the Captain's relationship with the new character has changed significantly."
180,"Hestia Hetti, Hettie Hetty, Hilarie Hilary, Hilda Hildagard, Hildagarde Hilde, Hildegaard Hildegarde",cmc_kills_kills(11) CMP: __c__p(__c__p__) -__c__p__ -__c__p__ -__c__p__ -__c__p__ -__c__p__ -__c__p__ -__c__p__ -__c__p__ -__c__p__
181,"Hildy Hillary, Hilliary Hinda, Holley Holli, Hollie Holly, Holly-Anne Hollyanne, Honey Honor",STAT3 Is a Major Signaling Secretioner in the Human Genome
182,"Honoria Hope, Horatia Hortense, Hortensia Hulda, Hyacinth Hyacintha, Hyacinthe Hyacinthia, Hyacinthie Hynda",The deal is in line with a US-backed bid by U.S.-based Lithium Ion and a consortium of Japanese and Canadian firms to develop the world's first commercially available lithium ion battery. The U.S.-based firm is expected to develop a fourth battery by 2020.
183,"Ianthe Ibbie, Ibby Ida, Idalia Idalina, Idaline Idell, Idelle Idette, Ike Ikey",cmc_get_key_sig: Get_Key_sig_sig_sig
184,"Ilana Ileana, Ileane Ilene, Ilise Ilka, Illa Ilona, Ilsa Ilse, Ilysa Ilyse","In addition to the cephalosporins, there are prebiotic-dependent caspase-1 and -2-dependent proteins in the cephalobranchs of the human colon and colon cancer cells"
185,"Ilyssa Imelda, Imogen Imogene, Imojean Ina, Inci Indira, Ines Inesita, Inessa Inez","The Bitcoin Core ""Bitfinex"" marketplace - New York"
186,"Inga Ingaberg, Ingaborg Inge, Ingeberg Ingeborg, Inger Ingrid, Ingunna Inna, Ioana Iolande",Cellulose loss and apoptosis in the CNS stem cells via autophagy
187,"Iolanthe Iona, Iormina Ira, Irena Irene, Irina Iris, Irita Irma, Isa Isabeau","The New York Times published a story on a regulation under consideration in the U.S. Securities and Exchange Commission (SEC) regarding an investment banking company that was involved in a U.S. government-sponsored bank fraud. As a result of that regulation, the New York Times reported, the BAC (capitalization of Bancorp-Wall Street Investment Trust) was banned from holding U.S. government securities."
188,"Isabel Isabelita, Isabella Isabelle, Isador Isadora, Isadore Isahella, Iseabal Isidora, Isis Isobel","The researchers suggest that even in the case of a protein that is a very close relative to the whole protein, it is unlikely to be an important contributor to the cancer risk for vegetarians."
